Department,Code,Sarvam STT,Corrected Transcription
Grievance,GV_Q_1.ogg,"हेलो, मैं बीसी से सुपरवाइजर अलका बोल रही हूँ। मुझे ये बोलना था कि हमारे यहाँ पे मैं चेकिंग टीम और फोल्डिंग टीम को देखती हूँ। तो मैं अगर कुछ चेकिंग टीम को बोल रही थी आज, तो शक्ति ने मुझे बोला कि ये क्यों छुट्टी पे से आई वापस? नहीं थी तो शांति था और अभी वो बोल रही है तू वापस चले जा। और उसने मुझे क्यों ऐसे बोला? प्लीज ऋषि। एंड अनु दीदी आप मेरी हेल्प कीजिए।",
Grievance,GV_Q_2.ogg,"दीदी, दीदी मैं हीना बोल रही हूँ, उसको बहुत परेशान किया है। संजू कुछ भी कुछ मार रहा है, सर में लकड़ा हिंच के मारा, सूजन पड़ गया सर में, हाथ में लग गया लकड़ा। वो सोने नहीं देता है। दीदी, अनु दीदी मैं हीना बोल रही हूँ, वो बहुत मार रहा है, सोने नहीं देता है, गंदा गंदा गाली देता है।",
HR-Admin,HR_Ad_Q_1.ogg,26 जनवरी को छुट्टी है कि चालू है?,छब्बीस जनवरी को छुट्टी है कि चालू है
HR-Admin,HR_Ad_Q_10.ogg,"मैं सरजू बात कर रहा हूँ बीसी ऑफिस से, मेरे पीएफ की जानकारी चाहिए।",मैं सरजू बात कर रहा हूँ बीसी ऑफिस से मेरे पीएफ की जानकारी चाहिए
HR-Admin,HR_Ad_Q_11.ogg,"लोन के बारे में। हेलो सर, मेरा लोन कितना बाकी है, ये भाई बोल रहे थे।",लोन के बारे में हेलो सर मेरा लोन कितना बाकी है मै अय्युब बोल रहा हू
HR-Admin,HR_Ad_Q_12.1.ogg,"तो दीदी मेरा यह जो लोन का जो खत्म करना है, यह कितने महीने में खत्म हो जाएगा? और है ना मुझे है ना प्रीति दीदी से बात करना है, प्रीति दीदी शायद आ नहीं रही है, तो जरा उनको भेजिए तो मैं उनसे पूछूँ।",तो दीदी मेरा यह जो लोन का जो खत्म करना है यह कितने महीने में खत्म हो जाएगा और है ना मुझे है ना प्रीति दीदी से बात करना है प्रीति दीदी शायद आ नहीं रही है तो जरा उनको भेजिए तो मैं उनसे पूछूँ
HR-Admin,HR_Ad_Q_12.ogg,"हाय टाइनी टीम, मैं भारती विक्रम परदेसी बोल रही हूँ डी सी ऑफिस से। मुझे यह जानना है कि जो मैंने कंपनी से लोन लिया था 50,000, तो वह अभी तक मतलब कितना और बाकी है भरना और मैं फिर दोबारा कब लोन के लिए अप्लाई कर सकती हूँ और किस को बोलना है मुझे लोन के लिए? प्लीज मुझे यह बताइए।",हाय टाइनी टीम मैं भारती विक्रम परदेसी बोल रही हूँ बीसी ऑफिस से मुझे यह जानना है कि जो मैंने कंपनी से लोन लिया था पचास हज़ार तो वह अभी तक मतलब कितना और बाकी है भरना और मैं फिर दोबारा कब लोन के लिए अप्लाई कर सकती हूँ और किस को बोलना है मुझे लोन के लिए प्लीज मुझे यह बताइए
HR-Admin,HR_Ad_Q_13.ogg,"हॅलो, गुड इव्हिनिंग, मी वत्सला बामणे बीसी ऑफिसमध्ये आहे, स्टिचिंगचं काम करते. मला त्या पर पीसवरती असाच पगार व्यवस्थित येत नाही, तर कृपया सॅलरीवर 20-25 हजारापर्यंत सॅलरी मिळेल. माझी 2 मुलं आहेत, त्यांच्या शिक्षणाचा खर्च, घर खर्च सगळं नाही त्या पगारावर चालत आहे, तर कृपया मला काही हेल्प मिळाली. किंवा सॅलरी सिस्टम म्हणजे 20-25 पर्यंत तरी गेला तरी मला आनंद होईल असं माझी इच्छा आहे. जर झालं काही त्याच्यातून मार्ग निघत असेल तर प्लीज काढा.",हॅलो गुड इव्हिनिंग मी वत्सला बामणे बी सी ऑफिसमध्ये आहे स्टिचिंगचं काम करते मला त्या पर पीसवरती असाच पगार व्यवस्थित येत नाही तर कृपया सॅलरीवर वीस -पंचवीस हजारापर्यंत सॅलरी मिळेल माझी दोन मुलं आहेत त्यांच्या शिक्षणाचा खर्च घरखर्च हे सगळं नाही त्या पगारावर चालत आहे तर कृपया मला काही हेल्प मिळाली किंवा सॅलरी सिस्टम म्हणजे वीस -पंचवीस पर्यंत तरी गेला तरी मला आनंद होईल असं माझी इच्छा आहे जर झालं काही त्याच्यातून मार्ग निघत असेल तर प्लीज काढा
HR-Admin,HR_Ad_Q_14.ogg,"आईजीपी में ना मैं रेखा बोल रही हूँ, आईजीपी में कितना दिन से मच्छर काट रहे हैं, लेकिन उसका कोई सलूशन नहीं निकल रहा है, क्यों ऐसा?",आईजीपी में ना मैं रेखा बोल रही हूँ आईजीपी में कितना दिन से मच्छर काट रहे हैं लेकिन उसका कोई सलूशन नहीं निकल रहा है क्यों ऐसा
HR-Admin,HR_Ad_Q_15.ogg,"हाउसकीपिंग वाले को है ना दीदी, 1 घंटा या आधा घंटा पहले बुलाओ, क्योंकि हम लोग मशीन के नीचे भी पोछा नहीं लगता है ना, तो मच्छर काटते हैं।",
HR-Admin,HR_Ad_Q_16.ogg,"मैं जुलेखा अंसारी बोल रही हूँ बीसी से, फ्लोर पर ना मच्छर बहुत काट रहे हैं, मच्छर के लिए कुछ कीजिए, थैंक यू।",
HR-Admin,HR_Ad_Q_17.ogg,"मैं सुशीला बोल रही हूँ मुंबई सेंटर से, मेरा लोन कभी ख़त्म होएगा?",
HR-Admin,HR_Ad_Q_18.ogg,"हम लोग की मशीन के पास गुड नाईट लगना चाहिए ना, उधर होल्डर नहीं है।",
HR-Admin,HR_Ad_Q_19.ogg,"मैं सुष्मिता, मुझे मैं ट्रेनिंग के लिए आती हूँ, मुझे थोड़ा पीएफ निकालना है।",
HR-Admin,HR_Ad_Q_2.ogg,और मैं टेनी मेडिकल से बोल रहा हूं। बॉम्बे सेंटर से। सर मेडिसिन मेरे को चाहिए था सर्दी और बदन दर्द के लिए। तो ये लोग स्टाफ लोग बोल रहे हैं कि नहीं है करके। और रखना बंद कर दिए पहले रखते थे सर। ठीक है।,और मैं टेनी मेडिकल से बोल रहा हूं बॉम्बे सेंटर से सर मेडिसिन मेरे को चाहिए था सर्दी और बदन दर्द के लिए तो ये लोग स्टाफ लोग बोल रहे हैं कि नहीं है करके और रखना बंद कर दिए पहले रखते थे सर ठीक है
HR-Admin,HR_Ad_Q_20.ogg,"नमस्ते सर जी, मेरा नाम शिव परदेशी है, बेतवाला सॉरी, शिव बेतवाला है। मुझे 2 चीज़ जानना है, पहला पीएफ ख़त्म हो चू ए सॉरी, पीएफ का पेमेंट कितना जमा हुआ है? और दूसरी बात, दूसरा लोन, लोन का कितना पैसा बाकी है कटना और कभी ख़त्म होगा? यही दोनों जानना है, धन्यवाद।",
HR-Admin,HR_Ad_Q_21.ogg,"हेलो, मैं बी सी ऑफिस से माधुरी माथुर बोल रही हूँ। मुझे पी एफ का मैसेज नहीं आता है, तो आप मुझे प्लीज़ हेल्प करोगे?",
HR-Admin,HR_Ad_Q_22.ogg,"हाय टाइनी टीम, मैं बी सी ऑफिस से बोल रही हूँ। मेरा नाम भारती है। मुझे मेरे पी एफ के बारे में जानना है कि अभी मैंने गए साल में मेरा पी एफ का पैसा निकाला था, तो वह निकालने के बाद में जब से अब तक मेरा पी एफ में कितना पैसा बचा है? और दूसरी बात यह है कि जो हमको पेड लिफ्ट मिलता है। वह पैडलिफ्ट किस महीने में मिलेगा और कितना मिलेगा?",
HR-Admin,HR_Ad_Q_23.ogg,"हाय टाइनी टीम, मैं भारती विक्रम परदेसी बोल रही हूँ। बिना दीदी मैं आपको पूछ रही हूँ अकाउंट्स का, आप ही देखते हो ना? तो मेरे अकाउंट्स में प्रॉब्लम है क्योंकि मेरा पेमेंट कम आया है जनवरी का। जिस तरीके से मुझे पेमेंट के बारे में बताया है तो मेरा पेमेंट कम आया है। मेरे पास पेमेंट स्लिप है लेकिन मेरा जो रिकॉर्ड है ना, मेरे रिकॉर्ड से मैंने जो जिस तरीके से मतलब मेरा ये था ना। मतलब मैंने हिसाब किया था तो मेरा ज़्यादा हो रहा है और मेरा है ना डेली बेसिस में 1 दिन का है और 1 दिन शूटिंग हो रहा था कंपनी में तो उसका भी बोले थे 1 दिन का फुल दिन फुल टाइम जे मतलब फुल टाइम का पैसा जैसा जो आएगा वैसा उसको मिलेगा तो उसका भी हिसाब मुझे मिला नहीं है तो आपसे मैं यह पूछ रही हूं कि मैं वह जो स्लिप है पेमेंट वह मैं आपको लाकर दिखाऊँ क्या? मैं कल आऊँ, आप मिलेंगे मुझे कल या फिर किससे पूछूँ? आप मुझे बताइए अकाउंट्स का और अलावा आपके अलावा और कौन देखता है? मुझे बताइए तो मैं उनसे पूछूँगी, मैं पेमेंट स्लिप उनको बताऊँगी।",
HR-Admin,HR_Ad_Q_24.ogg,"और मच्छर का गुड नाईट दिया है दीदी, लेकिन इधर ना पॉइंट नहीं है लगाने वाला।",
HR-Admin,HR_Ad_Q_25.ogg,मी बीसीओ ऑफिस से स्वाती बोल रही हूँ। मुझे है ना ये ये फ्लोर के लिए बोलना है कि एग्जस्ट फैन खिड़की के पास लगाओ। खाना खाने के टाइम जब बैठते है ना तो बहुत डस्ट उडता है।,
HR-Admin,HR_Ad_Q_26.ogg,"हेलो, मैं सीता राजेश बोल रही हूँ। साइनिंग मेडिकल से मैं स्टिचिंग का काम करती हूँ। यहाँ पर एजेस पेन की ज़रूरत है। क्योंकि यहाँ पर डस्ट बहुत होता है, पानी भी लेने जाते हैं तो वहाँ पर भी पानी के ऊपर भी डस्ट बहुत रहता है, आप प्लीज़ एक एडजस्ट फैन लगा दीजिए।",
HR-Admin,HR_Ad_Q_27.ogg,सर मुझे भी एक जेस्क फैन चाहिए।,
HR-Admin,HR_Ad_Q_28.ogg,"मेरा नाम रतिका जाधव है, मैं बीसी से बोल रही हूँ, मेरा जो भी पीएफ है वो मेरे अकाउंट में डालो।",
HR-Admin,HR_Ad_Q_29.ogg,"ऋषि सर हमको ये टेबल नहीं जम रहा है, प्लीज हम लोग के लिए एक चेयर करो सबके लिए। मैं मुंबई सेंटर से बोल रही हूँ सीमा।",
HR-Admin,HR_Ad_Q_3.ogg,"मेरा नाम ज्योति है, मैं बीसी से बोल रही हूँ, मुझे मेरा पीएफ का अमाउंट जानना है।",मेरा नाम ज्योति है मैं बीसी से बोल रही हूँ मुझे मेरा पीएफ का अमाउंट जानना है
HR-Admin,HR_Ad_Q_4.ogg,"मैं हदिका बोल रही हूँ, मुझे ना पीएफ के बारे में बोलना है, पीएफ का पैसा मुझे ना निकाल के ट्राई करना है कि मेरा आ पा रहा है कि नहीं, ठीक है।",मैं हदिका बोल रही हूँ मुझे ना पीएफ के बारे में बोलना है पीएफ का पैसा मुझे ना निकाल के ट्राई करना है कि मेरा आ पा रहा है कि नहीं ठीक है
HR-Admin,HR_Ad_Q_5.ogg,"मैं हेमलता परदेसी बीसी ऑफिस से, मुझे मेरा पीएफ का पैसा जानना है।",मैं हेमलता परदेसी बीसी ऑफिस से मुझे मेरा पीएफ का पैसा जानना है
HR-Admin,HR_Ad_Q_6.ogg,"मैं बबीता विलास बोल रही हूँ, मेरा पूरे साल का पीएफ कितना जमा हुआ है वो भी मुझे पता करना है।",मैं बबीता विलास बोल रही हूँ मेरा पूरे साल का पीएफ कितना जमा हुआ है वो भी मुझे पता करना है
HR-Admin,HR_Ad_Q_7.ogg,मुझे पीएफ निकालना है।,मुझे पीएफ निकालना है
HR-Admin,HR_Ad_Q_8.ogg,"मैं डाइनिंग कंपनी से बोल रही हूँ, अफसरा ग्रैंड डोर बिल्डिंग से मेरा पीएफ का पैसा कितना जमा हुआ है आप बता दो।",मैं टाइनी कंपनी से बोल रही हूँ अप्सरा ग्रांट रोड बिल्डिंग से मेरा पीएफ का पैसा कितना जमा हुआ है आप बता दो
HR-Admin,HR_Ad_Q_9.ogg,"सर मैं अजीब खान बोल रहा हूँ, अजीब खान बोल रहा हूँ, जी सर से काम है, मेरा पीएफ का पैसा और लोन कितना कटा है आप बताइए प्लीज।",सर मैं अय्युब खान बोल रहा हूँ अय्युब खान बोल रहा हूँ दिनेश सर से काम है मेरा पीएफ का पैसा और लोन कितना कटा है आप बताइए प्लीज
Helpdesk,HD_Q_2.ogg,"हॅलो, मी करुणा गावडे, मला आयुष्यमान कार्ड काढायचं आहे, त्याच्यासाठी काय काय डॉक्युमेंट लागतील?",हॅलो मी करुणा गावडे मला आयुष्यमान कार्ड काढायचं आहे त्याच्यासाठी काय काय डॉक्युमेंट लागतील
Helpdesk,HD_Q_3.ogg,"मेरे लड़के का डेथ सर्टिफिकेट मंगाना है, अभी तक निकाला नहीं है तो उसके लिए क्या कर सकते हैं?",मेरे लड़के का डेथ सर्टिफिकेट मंगाना है अभी तक निकाला नहीं है तो उसके लिए क्या कर सकते हैं
Helpdesk,HD_Q_4.ogg,"मेरा नाम सीमा है, आपने जो मेरा वोटिंग कार्ड बनाया था वह मुझे बनाकर चाहिए।",मेरा नाम सीमा है आपने जो मेरा वोटिंग कार्ड बनाया था वह मुझे बनाके चाहिए
Helpdesk,HD_Q_5.ogg,"हेलो मैडम, मैं चंदा देवी बोल रही हूँ। हमारे आधार कार्ड में यहाँ का एड्रेस डालने का है, हो जाएगा क्या?",हेलो मैडम मैं चंदा देवी बोल रही हूँ हमारे आधार कार्ड में यहाँ का एड्रेस डालने का है हो जाएगा क्या
Helpdesk,HD_Q_6.ogg,"हॅलो प्रीती, मी सारिका बोलते आहे. त्या पोपलकर मावशी आहेत ना, त्यांनी काय सांगितलंय की त्यांचं डॉक्युमेंट्स सबमिट केलंय त्यांनी, तर त्यांचं काम झालेलं आहे, थोडंसंच राहिलंय आता बघतो.",हॅलो प्रीती मी सारिका बोलते आहे त्या पोपलकर मावशी आहेत ना त्यांनी काय सांगितलंय की त्यांचं डॉक्युमेंट्स सबमिट केलंय त्यांनी तर त्यांचं काम झालेलं आहे थोडंसंच राहिलंय आता बघतो
Helpdesk,HD_Q_7.ogg,"मी संचिता ऐके बोलते आहे, आज आपल्याला पोस्टात जायचं आहे.",मी संचिता ऐके बोलते आहे आज आपल्याला पोस्टात जायचं आहे
Helpdesk,HD_Q_8.ogg,कौन सा फॉर्म भरा था वो मुझे समझ में नहीं आ रहा है और मालूम भी नहीं है।,कौन सा फॉर्म भरा था वो मुझे समझ में नहीं आ रहा है और मालूम भी नहीं है
Helpdesk,Hd_Q_1.ogg,"हेलो दीदी, मैं दिव्या बोल रही हूँ, मेरा आधार कार्ड पैन कार्ड लिंक नहीं है तो क्या करूँ मैं?",हेलो दीदी मैं दिव्या बोल रही हूँ मेरा आधार कार्ड पैन कार्ड लिंक नहीं है तो क्या करूँ मैं
Helpdesk,Hd_Q_10.ogg,"मैं निर्मला प्रजापति, पोस्ट ऑफिस में मुझे पैसा भरना है, क्या-क्या डॉक्यूमेंट लगेगा?",मैं निर्मला प्रजापति पोस्ट ऑफिस में मुझे पैसा भरना है क्या-क्या डॉक्यूमेंट लगेगा
Helpdesk,Hd_Q_100.ogg,"मुझे पैन कार्ड करेक्शन करना है बी सी ऑफिस से, मेरा नाम पवन है।",
Helpdesk,Hd_Q_101.ogg,"Good afternoon sir, my name is Bhavesh. I want to make my election card and PAN card.",
Helpdesk,Hd_Q_102.ogg,"सर, मैं बबीता विलास मुंबई सेंटर से, मुझे पैन कार्ड का नाम चेंज करना है।",
Helpdesk,Hd_Q_103.ogg,"हेलो दिनेश सर, मैं बीसी से प्रीतम बोल रहा हूँ। मुझे केवाईसी के लिए जानकारी चाहिए था और लाड़की बहन का।",
Helpdesk,Hd_Q_104.ogg,"मैं मुंबई सेंटर से नंदिनी परदेसी बोल रही हूँ, मुझे पैन कार्ड में नाम चेंज कराना है, मुंबई सेंटर बीसी से।",
Helpdesk,Hd_Q_105.ogg,"सर मैं बॉम्बे सेंटर से बोल रही हूँ, मेरा नाम सुधा है, मैं आधार अपडेट करने के लिए दी थी, अभी तक मेरा हुआ नहीं है वो।",
