Department,Code,Sarvam STT,Corrected Transcription
Production,P_Q_20.ogg,"हेलो अनु दीदी, मैं सीता बोल रही हूँ। मेरा पेमेंट में ₹1000 कम आया है। आप ज़रा चेक करके देखिए ना। मैंने ना 2 संडे को मैंने टेलीविज़न का काम किया था। एक एक बार मैंने शूटिंग का काम किया था और एक बार टेलीविज़न का काम किया। आप देख के बताइए।",
Production,P_Q_21.ogg,"मैं मुंबई सेंटर से नंदनी परदेसी बोल रही हूँ, मैं भी इसी से बोल रही हूँ। मेरा अल्टर है ना, ललिता है ना, मेरा अल्टर बहुत निकालती है, बहुत हद से ज़्यादा। वो ऐसा लगता है कभी-कभी अपने से ही अल्टर को कट कर देती है।",
Production,P_Q_22.ogg,"दीदी मैं बीसी से बोल रहा हूं शक्ति। अब आज सुबह क्या हुआ दीदी हम लोग ऑल्टर लेते हैं ना तो तापट तोप बना के दे देते हैं। जो ब्लू धागा रहता है या नहीं रहता है ना तो ब्लू धागा लगाने के बाद में हम लोग ऑल्टर दे देते हैं। अभी कल की बात है सबको मैं दे दिया तीनों जन मेरे को ऑल्टर दिए थे। सबको दे दिया है बाला बोलती है तीन चार दिन पहले मैं दी थी तो दिया ही नहीं अभी तक। ऐसा बोला मेरे पास कुछ है ही नहीं पीस। 25 के अलावा जो एक्स्ट्रा रहेगा तो मैं दूंगा ना, तो बाद में थोड़ा आज सुबह इशू हो गया।",
Production,P_Q_23.ogg,"हेलो, मैं बीसीजी से बोल रही हूँ और मैं जो भी अल्टर देती हूँ इधर पर चेक इन करके, तो इधर कोई अपसेट करता नहीं है हमें। सपना परदेसी के सामने अल्टर दी थी और वो शक्ति अपसेट करता ही नहीं है और मैं बोलने के अल्टर मांग रही है, मांग रहे तो वो चिल्ला चिल्ला के हम लोग के ऊपर अकड़ता है। हम लोग को अपसेट करता नहीं लेडीज़ लोग से कैसा बात करने का, ऐसा ऐसा बात पे हम लोग को सब कोई। जितने जन है ना उतने जन बोलते हैं और अल्टर करके ही नहीं देते झूठ झूठ बोलते हैं दिए हैं हम लोग दिया है और बोलने जाएंगे तो लड़ने के लिए चढ़ते हैं मैं भावना भावना परदेसी बोल रही हूं",
Production,P_Q_24.ogg,"हेलो सर, मैं ये बोल रहा हूँ मुंबई चल रहे थे। ये आशीष भी देने वाला नाटक करता है बोले। लाख लाख देता है, दोस्तों को अच्छा भी देता है। तो बोलता है करना है करो तो जाओ बोलता है।",
Production,P_Q_25.ogg,दीदी सब ऐसा पीस है मुड़ा हुआ तो सब बोलते हैं हमको सीधा सीधा पीस दे मुड़ा वाला नहीं चाहिए।,
Production,P_Q_26.ogg,"मैं बीसी ऑफिस से हदीका बोल रही हूँ, मेरी मशीन ख़राब थी तो फिर बनने के लिए गई थी, 4 दिन के बाद आई है बनके, फिर भी मशीन वैसे ही चल रही है, मशीन ठीक हुई नहीं है और मुझे बहुत प्रॉब्लम हो रहा है और मेरी जगह चेंज हो सकती है, मेरी जगह चेंज ख़राब होती है, तो जगह चेंज करना। तो फिर ये जगह चेंज करना ये प्रॉब्लम हो रहा है इधर पे।",
Production,P_Q_27.ogg,"हाँ सर, मैं राकेश सर से बात करना चाहती हूँ। मैं ग्रैंड रोड के ऑफिस से बोल रही हूँ, यास्मीन अय्यूब खान। मेरे को आशीष के खिलाफ कंप्लेंट करना है। वह वह है ना किसी को मतलब पॉलिसिटी मतलब पीस बराबर दे नहीं रहा है। किसी किसी को एकदम अच्छा निकाल के दे रहा है और किसी के साथ ऐसा बोलता है और सामने वाला बोलेगा तो बोलता है डायरेक्ट घर जाओ।",
Production,P_Q_28.ogg,"राकेश सर, यह मैसेज आपके लिए है। मैं बी सी ऑफिस से भारती बोल रही हूँ। फ्लोर में अभी भी जब माल खत्म होता है, यानी पीस खत्म होता है, जब थोड़ा पीस बचता है, तो फ्लोर में सभी लोग के पास में, बहुत सारे लोग के पास में बिना एंट्री कराए एक-एक पी मतलब एक-एक 25 का बंच होता है सर, हाँ। और ना सुपरवाइजर लोग ध्यान देते हैं या नहीं देते हैं यह मुझे नहीं मालूम, लेकिन बहुत सारे लोग के पास रहता है, वह लोग को बोलो ध्यान देने के लिए। ठीक है, मैं अपना भी बता रही हूँ, 2-4 पीस एक्स्ट्रा रखते हैं हम, सभी रखते हैं, 2-4 पीस जो भी है, 2-4, 5-6 जो भी है, एक्स्ट्रा रखते हैं, लेकिन एंड में हम लोग उसको एडजस्ट करते हैं। लेकिन ऐसे नहीं करते हैं कि हम एंट्री कराए नहीं हैं और पीस लेकर रख लिए हैं क्योंकि हमको पता चल गया है कि अब पीस थोड़ा है, माल खत्म होने वाला है, आएगा कब आएगा कब नहीं आएगा, तो हम ऐसे करके रख लें। तो बहुत सारे लोग हैं जिनका मैं नाम नहीं ले सकती क्योंकि मुझे है ना सभी को डर रहता है कि हमारी बात लीक होती है इसीलिए मैं नाम नहीं ले सकती हूँ। लेकिन प्लीज़ आप सुपरवाइज़र को बोलो कि चेक करें जब भी माल थोड़ा होता है, सबके पास पीस चेक करें किसके पास है या नहीं है, फ़ाइल चेक करें कल का कितना माल है, कितना लिए हैं। सर इसमें क्या प्रॉब्लम है? जो स्लो है उनको नहीं मिल पाता, मेरे जैसे बहुत सारे लोग स्लो हैं और ऐसे चालाक लोग जो फ़ास्ट हैं बहुत सारे लोग। हैं 5-6 लोग जिसका मैं नाम नहीं लूँगी, तो वो लोग क्या करते हैं, ऐसे करते हैं।",
Production,P_Q_3.ogg,"హలో సార్, గుడ్ ఈవెనింగ్. ఇదర్ ఎక్స్ట్రా కామ్ రే కనా అప్నా సబ్ లేడీస్ లోక్ బోల్ రే. ఈవెనింగ్ మే ఏక్ గంట ఓర్ టైం చాహియే. శాయిద్ ఫిబ్రవరి మే సే ఉన్ లోక్ కో చాహియే కర్కే బోల్ రే.",हेलो सर गुड इवनिंग इधर एक्स्ट्रा काम रहेगा ना अपना सब लेडीज लोग बोल रहे हैं इवनिंग में एक घंटा और टाइम चाहिए शायद फरवरी में से उन लोग को चाहिए करके बोल रहे हैं
Production,P_Q_4.ogg,"हमें ओटी के टाइम में शाम को ही नाश्ता चाहिए, 4 बजे नाश्ता करेंगे तो 7 बजे भूख लगती है और चाय भी नहीं मिलती है।",हमें ओटी के टाइम में शाम को ही नाश्ता चाहिए चार बजे नाश्ता करेंगे तो सात बजे भूख लगती है और चाय भी नहीं मिलती है
Production,P_Q_5.ogg,"हमें 4 बजे नाश्ता नहीं चाहिए, 6.30 बजे चाय और नाश्ता दोनों चाहिए।",हमें चार बजे नाश्ता नहीं चाहिए साडे छेह बजे चाय और नाश्ता दोनों चाहिए
Production,P_Q_6.ogg,"हमें 4 बजे नाश्ता नहीं चाहिए, हमें 6.30 बजे नाश्ता और चाय चाहिए।",हमें चार बजे नाश्ता नहीं चाहिए हमें साडे छेह बजे नाश्ता और चाय चाहिए
Production,P_Q_7.ogg,"हेलो, मैं संचिता आईके बोल रही हूँ। मेरे मशीन पर जो भी कारीगर बैठता है, सब कुछ चीज़ कोई भी जगह पर नहीं रखता है। स्क्रू ड्राइवर नहीं है, पट्टी नहीं है, मशीन का सिलाई बड़ा टाका करके ऐसे ही छोड़ के जाता है।",हेलो मैं संचिता आईके बोल रही हूँ मेरे मशीन पर जो भी कारीगर बैठता है सब कुछ चीज़ कोई भी जगह पर नहीं रखता है स्क्रू ड्राइवर नहीं है पट्टी नहीं है मशीन का सिलाई बड़ा टाका करके ऐसे ही छोड़ के जाता है
Production,P_Q_8.1.ogg,"दीदी, मैंने मैसेज नहीं देखा था, मैं मैसेज अभी देख रहा हूं। लेकिन ये स्टाफ लोग उधर बैठे हैं, वो खाना खाने गया तो उससे चाबी ले लेने का ना दीदी। चाबी लेके फिर हम लोग जो हम लोग का खाना खाने हम लोग गए हो हम हम लोगों को मालूम है हम लोगों का टाइम वेस्ट होएगा। लेकिन खाना खा के आए हैं, वो खाना खाने गया तो आप लोग चाबी ले लेना चाहिए ना उससे कि कोई आएगा कुछ चीज मांगेगा तो देना पड़ेगा। तो इसके हिसाब से मैंने मैसेज किया। राकेश सर ने बोला था कुछ। वो अडेक्शन का कुछ होएगा तो तुम मेरे को बोलो, तो मैंने मैसेज भेजा दीदी और क्या?",
Production,P_Q_8.ogg,"हेलो सर, मैं धनराज बोल रहा हूँ, राकेश सर, मैं अभी इधर पर हूँ, अभी ऑफिस में मैं लेबल मांग रहा हूँ, तो लेबल मेरे को नहीं दे रहे सर और मैं अभी वो लेबल की वजह से मेरा काम रुका है अभी।",हेलो सर मैं धनराज बोल रहा हूँ राकेश सर मैं अभी इधर पर हूँ अभी ऑफिस में मैं लेबल मांग रहा हूँ तो लेबल मेरे को नहीं दे रहे सर और मैं अभी वो लेबल की वजह से मेरा काम रुका है अभी
Production,P_Q_9.ogg,"मैं नंदिनी बोल रही हूँ मुंबई सेंटर बीसी से, आज मेरा मशीन के लिए थोड़ा मचमच हुआ। रोहिणी दीदी ने मुझे मशीन से उठाया, उस मशीन में सरजू ने बैठा। सरजू और जब मैंने पूछा कि दीदी मैं यहाँ से नहीं उठूँगी क्योंकि मैं भी काम करने आती हूँ, मुझे भी फिर मशीन नहीं मिलता है 3 बजे के बाद। तो बोला नहीं नहीं तुम उठो, तुम कल्पना के मशीन में बैठो। तो मैं बोली हाफ डे से मैं वापस से। सुनील सुनील के मशीन में बैठूंगी। सरजू का मशीन खराब था। तो मैंने सरजू को बोला कि तू यहां से मेरा भी मेरा अभी 3 बजे के बाद तू यहां पर बैठोगी तो मुझे डायरेक्टली बोला यहां से मैं मैं नहीं उठूंगा जाके तू दीदी को जो बोलना है बोल दे। जब मैं दीदी रोहिनी दीदी के पास गई तो रोहिनी दीदी ने बोला नहीं नहीं वो सरजू ही बैठेगा। दीदी हम लोग को हर डे से मशीन नहीं मिलता हम लोग यहां वहां बैठ के पीस मारते थे। प्लीज हम लोग के लिए कुछ करो। और जयश्री भी मुझे कितना उल्टा सीधा बोले कि हां मैं अभी मंजली को फोन करके बोलती हूं इसको बात करने नहीं आता है बल्कि जो कि सरजू अंकल को बात करने नहीं आ रहा है और वो भी मुझे बोले सरजू और जयश्री दोनों मुझे बोल रहे थे प्लीज हम लोग का मशीन का कुछ करो दीदी",मैं नंदिनी बोल रही हूँ मुंबई सेंटर बीसी से आज मेरा मशीन के लिए थोड़ा मचमच हुआ रोहिणी दीदी ने मुझे मशीन से उठाया उस मशीन में सरजू ने बैठा सरजू और जब मैंने पूछा कि दीदी मैं यहाँ से नहीं उठूँगी क्योंकि मैं भी काम करने आती हूँ मुझे भी फिर मशीन नहीं मिलता है तीन बजे के बाद तो बोला नहीं नहीं तुम उठो तुम कल्पना के मशीन में बैठो तो मैं बोली मैं हाफ डे से मैं वापस से सुनील के मशीन में बैठूँगी सरजू का मशीन खराब था तो मैंने सरजू को बोला कि तो यहां से मेरा भी मेरा अभी तीन बजे के बाद तू यहां पर बैठोगी तो मुझे डायरेक्टली बोला यहां से मैं मैं नहीं उठूंगा जाके तू दीदी को जो बोलना है बोल दे जब मैं दीदी रोहिनी दीदी के पास गई तो रोहिनी दीदी ने बोला नहीं नहीं वो सरजू ही बैठेगा दीदी हम लोग को हफ डे से मशीन नहीं मिलता हम लोग यहाँ वहाँ बैठ के पीस मारते प्लीज हम लोग के लिए कुछ करो और जयश्री भी मुझे कितना उल्टा सीधा बोले कि हाँ मैं अभी मंजरी को फ़ोन करके बोलती हूँ इसको बात करने नहीं आता है बल्कि जो कि सरजू अंकल को बात करने नहीं आ रहा है और वो भी मुझे बोली सरजू और जयश्री दोनों मुझे बोल रहे थे प्लीज हम लोग का मशीन का कुछ करो दीदी
