Department,Code,Sarvam STT,Corrected Transcription
Helpdesk,Hd_Q_106.ogg,दिनेश और मेरी दृष्टि का ना आधार कार्ड बनाने का है वो पांच साल कंप्लीट हो गया है ना? पांच साल का बना हुआ है। रिन्यू कराने का। पांच पांच साल का हो गया ये उसका खाली आधार कार्ड है रिन्यू करना है।,
Helpdesk,Hd_Q_107.ogg,"हेलो सर, मैं मीनू बोल रही हूँ। हाँ, मुझे आयुष्मान कार्ड फैमिली के लिए बनाना है और पैन कार्ड करना है, आधार कार्ड करना है। मेरा चोरी हो गया सर। गया? लाल बटन दबाओ।",
Helpdesk,Hd_Q_108.ogg,"मैं बीसी ऑफिस से बोल रही हूँ, मेरा नाम कल्पना सनी है, मेरे को बच्चे को कॉलेज ट्रिप के लिए क्या क्या डॉक्यूमेंट देना है?",
Helpdesk,Hd_Q_109.ogg,"मैं रेणु परदेसी बोल रही हूँ, मुझे मेरी बेटी का दृष्टि का आधार कार्ड वापस बनाने का है। उसका 5 साल कंप्लीट हो गया है ना, तो उसके लिए मुझे आधार कार्ड बनाने का है। दिनेश सर, कल मुझे...",
Helpdesk,Hd_Q_11.ogg,"मॅडम, मी संध्या पवार बोलते. मी पोस्टमध्ये गेली होती आयडी खोलण्यासाठी, तर आधार कार्ड पेन कार्ड लिंक नाही. तर त्यांनी सांगितलेत आधार कार्ड पेन कार्ड लिंक करण्यासाठी तर कोणते कोणते डॉक्युमेंट्स लागतील?",मॅडम मी संध्या पवार बोलते मी पोस्टमध्ये गेली होती आर्दी खोलण्यासाठी तर आधार कार्ड पेन कार्ड लिंक नाही तर त्यांनी सांगितलेत आधार कार्ड पेन कार्ड लिंक करण्यासाठी तर कोणते कोणते डॉक्युमेंट्स लागतील
Helpdesk,Hd_Q_110.ogg,"मी रंजना कोलेकर टायनी मेमाईडीशी टायनी मिरेकलमधून बोलते, मला लोन हवं आहे.",
Helpdesk,Hd_Q_12.ogg,"मी प्रमिला जाधव, माझ्या मुलीच्या कॉलरशिपचा फॉर्म भरायचा आहे. कोणते कोणते डॉक्युमेंट्स घेऊन येऊ?",मी प्रमिला जाधव माझ्या मुलीच्या स्कॉलरशिपचे फॉर्म भरायचा आहे कोणते कोणते डॉक्युमेंट्स घेऊन येऊ
Helpdesk,Hd_Q_13.ogg,"मी बेबी परफ आहे, माझा आधार कार्ड अपडेट केलेला अजून आला नाही आहे, ते मला पाहिजेत आहे.",मी बेबी बरफ़ आहे माझा आधार कार्ड अपडेट केलेला अजून आला नाही आहे ते मला पाहिजेत आहे
Helpdesk,Hd_Q_14.ogg,"मी वर्षा किरकिरे स्टिचिंग डिपार्टमेंटमध्ये आहे. मी आधार कार्ड अपडेट केलं, ते अजूनपर्यंत आलं नाही आहे.",मी वर्षा किरकिरे स्टिचिंग डिपार्टमेंटमध्ये आहे मी आधार कार्ड अपडेट केलं ते अजूनपर्यंत आलं नाही आहे
Helpdesk,Hd_Q_15.ogg,"मी लता पाटील, मला पोस्टर सेव्हिंग अकाउंट खोलायचा आहे, ओपन करायचा आहे, तर कोणकोणते डॉक्युमेंट पाहिजे?",मी लता पाटील मला पोस्टर सेव्हिंग अकाउंट खोलायचा आहे ओपन करायचा आहे तर कोणकोणते डॉक्युमेंट पाहिजे
Helpdesk,Hd_Q_16.ogg,"मी विद्या मगरे माझ्या मुलीचे स्कॉलरशिपचे फॉर्म भरायचा आहे, त्याच्यासाठी कोणते कोणते डॉक्युमेंट लागणार आहेत?",मी विद्या मगरे माझ्या मुलीचे स्कॉलरशिपचे फॉर्म भरायचा आहे त्याच्यासाठी कोणते कोणते डॉक्युमेंट लागणार आहेत
Helpdesk,Hd_Q_17.ogg,"मी सारिका कांबळे, पोराचं पीपीएलचं अकाउंट ओपन करायचं आहे, काय काय डॉक्युमेंट्स लागणार?",मी सारिका कांबळे पोराचं पीपीएलचं अकाउंट ओपन करायचं आहे काय काय डॉक्युमेंट्स लागणार
Helpdesk,Hd_Q_18.ogg,"मी कृतिका सावरे, माझ्या मुलींच्या अकाउंटमध्ये पैसे भरायचे आहेत, तर ते कसे भरायचे? सुकन्याचे.",मी कृतिका सावरे माझ्या मुलींच्या अकाउंटमध्ये पैसे भरायचे आहेत तर ते कसे भरायचे सुकन्याचे
Helpdesk,Hd_Q_19.ogg,"मैं इंदू जायसवाल, आपने जो सेशन लिया था उस पॉलिसी का नाम क्या है? हमें जानना है।",मैं इंदू जायसवाल आपने जो सेशन लिया था उस पॉलिसी का नाम क्या है हमें जानना है
Helpdesk,Hd_Q_20.ogg,"मेरा नाम टी बामा, मेरा पैन कार्ड नाम चेंज करने का आधार कार्ड अपडेट किया, क्या क्या डॉक्यूमेंट्स चाहिए?",मेरा नाम टी बामा मेरा पैन कार्ड नाम चेंज करने का आधार कार्ड अपडेट किया क्या क्या डॉक्यूमेंट्स चाहिए
Helpdesk,Hd_Q_21.ogg,"मेरा नाम कलेरसी, मेरे को आयुष्मा कार्ड बनाने का उसको क्या क्या ट्रैक मेट चाहिए?",मेरा नाम कलेरसी मेरे को आयुष्मा कार्ड बनाने का उसको क्या क्या डॉक्यूमेंट्स चाहिए
Helpdesk,Hd_Q_22.ogg,"मी निकिता महाले, माझ्या मुलाचं रॅशन कार्डवरती नाव चढवायचं आहे, त्याच्यासाठी काय काय डॉक्युमेंट्स लागतील?",मी निकिता महाले माझ्या मुलाचं रॅशन कार्डवरती नाव चढवायचं आहे त्याच्यासाठी काय काय डॉक्युमेंट लागतील
Helpdesk,Hd_Q_23.ogg,"मी शीला सदाफुले, माझ्या नवऱ्याचा आधार कार्ड अपडेट केलेलं आहे, ते आले नाही आहे.",मी शीला सदाफुले माझ्या नवऱ्याचा आधार कार्ड अपडेट केलेला आहे ते आले नाही आहे
Helpdesk,Hd_Q_24.ogg,"मी रुपाली मिरके, मला आयुष्मान कार्ड काढायचं आहे, तर कोणते डॉक्युमेंट्स लागतील ते सांगा.",मी रुपाली मिरके मला आयुष्मान कार्ड काढायचं आहे तर कोणते डॉक्युमेंट्स लागतील ते सांगा
Helpdesk,Hd_Q_25.ogg,"मैं रेखा आकाश परदेसी बोल रही हूँ, बॉम्बे सेंटर बीसी से। मुझे मेरे राशन कार्ड का इनकम कम कराना है, तो उसका हल कैसे निकलेगा? छोड़ूँ?",मैं रेखा आकाश परदेसी बोल रही हूँ बॉम्बे सेंटर बीसी से मुझे मेरे राशन कार्ड का इनकम कम कराना है तो उसका हल कैसे निकलेगा छोड़ूँ
Helpdesk,Hd_Q_26.ogg,मला आयुष्यमान कार्ड बनवायचं आहे.,मला आयुष्यमान कार्ड बनवायचं आहे
Helpdesk,Hd_Q_27.ogg,"हाय, मी सैन्याज बाबा, मला लोन पाहिजे, एक लाखापर्यंत मिळू शकतो का?",हाय मी सैन्याज बाबा मला लोन पाहिजे एक लाखापर्यंत मिळू शकतो का
Helpdesk,Hd_Q_28.ogg,"हेलो दीदी, मैं भावना बोल रही हूँ और मैं बी डी सी जी से बोल रही हूँ और है ना मेरे को घर का जो भी तकलीफ़ है वो पेपर के लिए मेरे को खाली राशन कार्ड अगर नया बनाना रहेगा तो क्या करना पड़ेगा? नया राशन के लिए मेरे को नाम चढ़ाना है राशन कार्ड में, कार्ड ही बनाना है मेरे को। वो मेरे को मदद चाहिए और मेरे को इतना जानना है पीएफ कितना है मेरा बस और आप इस इसमें भेजो मेरे को मैं इंतजार करूंगी",हेलो दीदी मैं भावना बोल रही हूँ और मैं बी डी सी जी से बोल रही हूँ और है ना मेरे को घर का जो भी तकलीफ़ है वो पेपर के लिए मेरे को खाली राशन कारट अगर नया बनाना रहेगा तो क्या करना पड़ेगा नया राशन के लिए मेरे को नाम चढ़ाना है राशन कार्ड में कार्ड ही बनाना है मेरे को वो मेरे को मदद चाहिए और मेरे को इतना जानना है पीएफ कितना है मेरा बस और आप इस इसमें भेजो मेरे को मैं इंतज़ार करूँगी
Helpdesk,Hd_Q_29.ogg,"मेरा नाम वंदना है, मैं मुंबई सेंट्रल ऑफिस से बोल रही हूँ। मुझे ना, मेरा मानपुर से राशन कार्ड है, तो मुझे यहाँ पर ट्रांसफर करवाना है।",मेरा नाम वंदना है मैं मुंबई सेंट्रल ऑफिस से बोल रही हूँ मुझे ना मुझे मेरा मानपुर से राशन कार्ड है तो मुझे यहाँ पर ट्रांसफर करवाना है
Helpdesk,Hd_Q_30.ogg,"मी संध्या पवार बोलते, माझं आधार कार्ड पॅन कार्ड लिंक झालं आहे, आरडी खोलण्यासाठी कोणते कोणते डॉक्युमेंट्स लागतील ते सांगा.",मी संध्या पवार बोलते माझं आधार कार्ड पॅन कार्ड लिंक झालं आहे आरडी खोलण्यासाठी कोणते कोणते डॉक्युमेंट्स लागतील ते सांगा
Helpdesk,Hd_Q_31.ogg,"मी संगीता नडगे, माझ्या मुलाचं आधार कार्ड अपडेट केलेलं आहे पण अजून आलेलं नाही.",मी संगीता नडगे माझ्या मुलाचं आधार कार्ड अपडेट केलेलं आहे पण अजून आलेलं नाही
Helpdesk,Hd_Q_32.ogg,"गुडमेश कुमार, मुझे आयुष्मान कार्ड निकालना है।",गुडमेश कुमार मुझे आयुष्मान कार्ड निकालना है
Helpdesk,Hd_Q_33.ogg,"मी नीलम मिरके, माझ्या मुलांचं राशन कार्डावरती नाव चढवायचं आहे आणि माझं पण नाव चढवायचं आहे.",मी नीलम मिरके माझ्या मुलांचं राशन कार्डावरती नाव चढवायचं आहे आणि माझं पण नाव चढवायचं आहे
Helpdesk,Hd_Q_34.ogg,"मी निकिता महाले, मला मॅरेज सर्टिफिकेट काढायचं आहे, काय काय डॉक्युमेंट्स लागतील?",मी निकिता महाले मला मॅरेज सर्टिफिकेट काढायचं आहे काय काय डॉक्युमेंट्स लागतील
Helpdesk,Hd_Q_35.ogg,"मॅडम, मी कल्पना लोतडे, मला मॅरेज सर्टिफिकेट बनवायचं आहे, त्याच्यासाठी काय काय डॉक्युमेंट्स लागणार आहेत? झालं?",मॅडम मी कल्पना लोतडे मला मॅरेज सर्टिफिकेट बनवायचं आहे त्याच्यासाठी काय काय डॉक्युमेंट्स लागणार आहेत झालं
Helpdesk,Hd_Q_36.ogg,"हाय प्रीती मॅडम, मी अपर्णा पवार बोलते, म्हणजे 2 महिन्याचे पेंडिंग होते साथी ॲपचे बॅलन्स जे मी आता भरले आहेत आणि फेब्रुवारीचे सुद्धा भरलेले आहेत, तर तुम्ही एकदा चेक करा, ओके? तर सरांनी सांगितलेलं की पे केल्यानंतर तुम्हाला सांगायला, त्यामुळे तुम्हाला मेसेज करते. तर डिसेंबर, जानेवारी आणि फेब्रुवारीचे असे 3 महिन्याचे मी भरलेले आहेत, ठीक आहे, तुम्ही एकदा चेक करा मॅडम.",हाय प्रीती मॅडम मी अपर्णा पवार बोलते म्हणजे दो महिन्याचे पेंडिंग होते साथी ॲपचे बॅलन्स जे मी आता भरले आहेत आणि फेब्रुवारीचे सुद्धा भरलेले आहेत तर तुम्ही एकदा चेक करा ओके तर सरांनी सांगितलेलं की पे केल्यानंतर तुम्हाला सांगायला त्यामुळे तुम्हाला मेसेज करते तर डिसेंबर जानेवारी आणि फेब्रुवारीचे असे तीन महिन्याचे मी भरलेले आहेत ठीक आहे तुम्ही एकदा चेक करा मॅडम
Helpdesk,Hd_Q_37.ogg,"प्रीती मॅडम, मी तन्वी राणे बोलते. मला स्कॉलरशिपसाठी ईमेल आला आहे.",प्रीती मॅडम मी तन्वी राणे बोलते मला स्कॉलरशिपसाठी ईमेल आला आहे
Helpdesk,Hd_Q_38.ogg,"मैं दिव्या पाली बोल रही हूँ, यह पूछना था कि लोन कभी पूरा होगा और दूसरा लोन ले सकते हैं क्या ज़रूरत है इसलिए।",मैं दिव्या पाली बोल रही हूँ यह पूछना था कि लोन कभी पूरा होगा और दूसरा लोन ले सकते हैं क्या ज़रूरत है इसलिए
Helpdesk,Hd_Q_39.ogg,"मी राजेश गावडे, मला गव्हर्नमेंटची 20 रुपयाची पॉलिसी पाहिजे.",मी राजेश गावडे मला गव्हर्नमेंटची वीस रुपयाची पॉलिसी पाहिजे
Helpdesk,Hd_Q_40.ogg,"हेलो सर, मैं दर्शना बोल रही हूँ, मुंबई सेंटर दिल्ली भेजर से मेरा आयुष्मान कार्ड बनाने का है, क्या डॉक्यूमेंट्स लाने का है?",हेलो सर मैं दर्शना बोल रही हूँ मुंबई सेंटर डेली वेजर से मेरा आयुष्मान कार्ड बनाने का है क्या डॉक्यूमेंट्स लाने का है
Helpdesk,Hd_Q_41.ogg,"मी आरती शिराळ, माझं आणि माझ्या मुलाचं आधार कार्ड अपडेट केलं ते आलं नाही, मला पाहिजे आहे.",मी आरती शिराळ माझं आणि माझ्या मुलाचं आधार कार्ड अपडेट केलं ते आलं नाही मला पाहिजे आहे
Helpdesk,Hd_Q_42.ogg,"मी पुष्पा, माझं आयुष्मान कार हलवलं आहे, मला परत काढायचं आहे.",मी पुष्पा माझं आयुष्मान कार्ड हारवले आहे मला परत काढायचं आहे
Helpdesk,Hd_Q_43.ogg,"मी माझं नाव भारती पागे आहे, मला आयुष्मान कार्ड काढायचं आहे, काय काय डॉक्युमेंट लागतील?",मी माझं नाव भारती पागे आहे मला आयुष्मान कार्ड काढायचं आहे काय काय डॉक्युमेंट लागतील
Helpdesk,Hd_Q_44.ogg,"हाय दीदी, मैं कल्पना सनी बोल रही हूँ, बी सी ए ऑफिस से, मुझे आधार कार्ड और पैन कार्ड लिंक कराना है।",हाय दीदी मैं कल्पना सनी बोल रही हूँ बीसी ऑफिस से मुझे आधार कार्ड और पैन कार्ड लिंक कराना है
Helpdesk,Hd_Q_45.ogg,"मी सरिता पागे, माझ्या राशन कार्डवरती ऑनलाइन नावं दिसत नाही.",मी सरिता पागे माझ्या राशन कार्डवरती ऑनलाइन नावं दिसत नाही
Helpdesk,Hd_Q_46.ogg,"மே கலை ரசி, மேரா பேட்டி கே நேம் ரேஷன் கார்டு மே லகானேக்கா, உஸ்கோ ஆதார் கார்டு நய் ஹே, பெட் சர்டிபிகேட் ஹே.",मै कलैरसी मेरी बेटी का नाम राशन कार्ड में लगाना है उसके पास आधार कार्ड नहीं है बर्थ सर्टिफिकेट है
Helpdesk,Hd_Q_47.ogg,स्मित मी स्मिता भोसाळकर माझ्या पॅन कार्डवर आधार स्पेलिंग चेंज करायचे त्याच्यासाठी काय काय डॉक्युमेंट लागतील?,मी स्मिता भोसाळकर माझ्या पॅन कार्डवर आधार स्पेलिंग चेंज करायचे त्याच्यासाठी काय काय डॉक्युमेंट लागतील
Helpdesk,Hd_Q_48.ogg,"मी जयंती सावंत, माझ्या आईकडचं आदर रेशन करते, नाव कट केलंय पण ते दिसत नाहीये.",मी जयंती सावंत माझ्या आईकडचं आदर रेशन कार्डचे नाव कट केलंय पण ते दिसत नाहीये
Helpdesk,Hd_Q_49.ogg,"मी जयंती सावंत, मला माझ्या हजबंडचं आणि मुलांचं आयुष्मान कार्ड बनवायचं आहे.",मी जयंती सावंत मला माझ्या हजबंडचं आणि मुलांचं आयुष्मान कार्ड बनवायचं आहे
Helpdesk,Hd_Q_50.ogg,"मेरा नाम लक्ष्मी है, मेरा राशन कार्ड का है और राशन मेरे नाम पे मिलता है, तीनों बच्चों को नहीं मिलता है।",मेरा नाम लक्ष्मी है मेरा राशन कार्ड का है और राशन मेरा नाम पे मिलता है तीनों बच्चों को नहीं मिलता है
Helpdesk,Hd_Q_51.ogg,"मैं उमा रानी बोल रही हूँ एमआईडीसी से, मुझे आयुष्मान कार्ड मेरे हस्बैंड के लिए और मेरे बच्चे के लिए बनाना है, क्या क्या डॉक्यूमेंट चाहिए?",मैं उमा रानी बोल रही हूँ एमआईडीसी से मुझे आयुष्मान कार्ड मेरे हस्बैंड के लिए और मेरे बच्चे के लिए बनाना है क्या क्या डॉक्यूमेंट चाहिए
Helpdesk,Hd_Q_52.ogg,"मैं बबीता विलास परदेसी मुंबई सेंट्रल आईजीपी से, मुझे लोन चाहिए।",मैं बबीता विलास परदेसी मुंबई सेंट्रल आईजीपी से मुझे लोन चाहिए
