Department,File Name,STT Transcription,STT Model,Human Reviewed,Final,Status,Reviewer,Timestamp
Helpdesk,HD_Q_2.ogg,हॅलो मी करुणा गावडे मला आयुष्यमान कार्ड काढायचं आहे त्याच्यासाठी काय काय डॉक्युमेंट लागतील,saarika:v2.5,,,pending_review,,2026-02-05T21:36:51.799042
Helpdesk,HD_Q_3.ogg,मेरे लड़के का डेथ सर्टिफिकेट मंगाना है अभी तक निकाला नहीं है तो उसके लिए क्या कर सकते हैं,saarika:v2.5,,,pending_review,,2026-02-05T21:36:54.225168
Helpdesk,HD_Q_4.ogg,मेरा नाम सीमा है आपने जो मेरा वोटिंग कार्ड बनाया था वो मुझे बना के चाहिए,saarika:v2.5,,,pending_review,,2026-02-05T21:36:57.153952
Helpdesk,HD_Q_5.ogg,हेलो मैडम मैं चंदा देवी बोल रही हूँ हमारे आधार कार्ड में यहाँ का एड्रेस डालने का है हो जाएगा क्या,saarika:v2.5,,,pending_review,,2026-02-05T21:37:00.195265
Helpdesk,HD_Q_6.ogg,"हॅलो प्रीती, मी सारिका बोलतेय. त्या कोपलकर मावशी आहेत ना, त्यांनी काय सांगितलंय की त्यांचं डॉक्युमेंट्स सबमिट केले त्यांनी, तर त्यांचं काम झालेलं आहे, थोडंसंच राहिलंय आता बघतो.",saarika:v2.5,,,pending_review,,2026-02-05T21:37:03.815185
Helpdesk,HD_Q_7.ogg,"मी संचिता ऐके बोलते आहे, आज आपल्याला पोस्टात जायचं आहे.",saarika:v2.5,,,pending_review,,2026-02-05T21:37:06.622667
Helpdesk,HD_Q_8.ogg,कौन सा फ़ोन भरा था मुझे समझ में नहीं आ रहा है और मालूम भी नहीं है।,saarika:v2.5,,,pending_review,,2026-02-05T21:37:10.105981
Helpdesk,Hd_Q_1.ogg,हेलो दीदी मैं दिव्या बोल रही हूँ मेरा आधार कार्ड पैन कार्ड लिंक नहीं है तो क्या करूँ मैं,saarika:v2.5,,,pending_review,,2026-02-05T21:37:13.253227
Helpdesk,Hd_Q_10.ogg,मैं निर्मला प्रजापति पोस्ट ऑफिस में मुझे पैसा भरना है क्या क्या डॉक्यूमेंट लगेगा,saarika:v2.5,,,pending_review,,2026-02-05T21:37:16.787666
Helpdesk,Hd_Q_11.ogg,"मॅडम मी संध्या पवार बोलते. मी पोस्टामध्ये गेले होते आयडी खोलण्यासाठी. तर आधार कार्ड, पेन कार्ड लिंक नाही. तर त्यांनी सांगितले आधार कार्ड, पेन कार्ड लिंक करण्यासाठी तर कोणते कोणते डॉक्युमेंट्स लागतील?",saarika:v2.5,,,pending_review,,2026-02-05T21:37:20.186658
Helpdesk,Hd_Q_12.ogg,"मी प्रमिला जाधव, माझ्या मुलीच्या स्कॉलरशिपचा फॉर्म भरायचा आहे. कोणते कोणते डॉक्युमेंट्स घेऊन येऊ?",saarika:v2.5,,,pending_review,,2026-02-05T21:37:23.030334
Helpdesk,Hd_Q_13.ogg,मी बेबी बर्फ आहे. माझा आधार कार्ड अपडेट केलेला अजून आला नाही आहे. ते मला पाहिजेच आहे.,saarika:v2.5,,,pending_review,,2026-02-05T21:37:26.920463
Helpdesk,Hd_Q_14.ogg,"मी वर्षा किरकिरे स्टिचिंग डिपार्टमेंटमध्ये आहे. मी आधार कार्ड अपडेट केलं, ते अजूनपर्यंत आलं नाही आहे.",saarika:v2.5,,,pending_review,,2026-02-05T21:37:30.198307
Helpdesk,Hd_Q_15.ogg,"मी लता पाटील, मला पोस्टर सेव्हिंग अकाउंट खोलायचा आहे. 
ओपन करायचा आहे. 
तर कोणकोणते डॉक्युमेंट पाहिजे?",saarika:v2.5,,,pending_review,,2026-02-05T21:37:33.373949
Helpdesk,Hd_Q_16.ogg,मी विद्या मगरे माझ्या मुलीचे स्कॉलरशिपचे फॉर्म भरायचा आहे. त्याच्यासाठी कोणते कोणते डॉक्युमेंट लागणार आहेत?,saarika:v2.5,,,pending_review,,2026-02-05T21:37:37.504609
Helpdesk,Hd_Q_17.ogg,"मी सारिका कांबळे, पोराचा पीपीएल अकाउंट ओपन करायचं आहे, काय काय डॉक्युमेंट्स लागणार?",saarika:v2.5,,,pending_review,,2026-02-05T21:37:40.648732
Helpdesk,Hd_Q_18.ogg,मी कृतिका सावरे माझ्या ना मुलींचा अकाउंट मध्ये पैसे भरायचे आहेत तर ते कसे भरायचे आहेत सुकन्याचे,saarika:v2.5,,,pending_review,,2026-02-05T21:37:44.160476
Helpdesk,Hd_Q_19.ogg,"मैं इंदु जयस्वाल, आपने जो सेशन लिया था उस पॉलिसी का नाम क्या है, हमें जानना है।",saarika:v2.5,,,pending_review,,2026-02-05T21:37:47.083934
Helpdesk,Hd_Q_20.ogg,मेरा नाम टी बामा मेरा पैन कार्ड नाम चेंज करने का आधार कार्ड अपडेट किया क्या क्या डॉक्यूमेंट चाहिए,saarika:v2.5,,,pending_review,,2026-02-05T21:37:50.884769
Helpdesk,Hd_Q_21.ogg,"मेरा नाम कलेर है सी, मेरे को आयुष्मा कार्ड बनाने को उसको कह कर ट्राक्मेट चाहिए।",saarika:v2.5,,,pending_review,,2026-02-05T21:37:53.687035
Helpdesk,Hd_Q_22.ogg,"मी निकिता महाले, माझ्या मुलाचं रेशन कार्डवरती नाव चढवायचं आहे. त्याच्यासाठी काय काय डॉक्युमेंट लागतील?",saarika:v2.5,,,pending_review,,2026-02-05T21:38:00.062713
Helpdesk,Hd_Q_23.ogg,मी शीला सदा फुले माझ्या नवऱ्याचा आधार कार्ड अपडेट केलेला आहे ते आले नाही आहे,saarika:v2.5,,,pending_review,,2026-02-05T21:38:03.190306
Helpdesk,Hd_Q_24.ogg,,saarika:v2.5,,,error,,2026-02-05T21:39:49.079389
Helpdesk,Hd_Q_25.ogg,"मैं रेखा आकाश परदेसी बोल रही हूँ, बॉम्बे सेंटर बीसी से। मुझे मेरे राशन कार्ड का इनकम कम कराना है, तो उसका हल कैसे निकलेगा? छोडूँ?",saarika:v2.5,,,pending_review,,2026-02-05T21:39:52.436106
Helpdesk,Hd_Q_26.ogg,मला आयुष्यमान कार्ड बनवायचं आहे,saarika:v2.5,,,pending_review,,2026-02-05T21:39:54.788330
Helpdesk,Hd_Q_27.ogg,हाय मी शैनाज बाबा मला लोन पाहिजे एक लाखापर्यंत मिळू शकतो का,saarika:v2.5,,,pending_review,,2026-02-05T21:39:57.513755
Helpdesk,Hd_Q_28.ogg,,saarika:v2.5,,,error,,2026-02-05T21:40:01.467880
Helpdesk,Hd_Q_29.ogg,"मेरा नाम वंदना है, मैं मुंबई सेंट्रल ऑफिस से बोल रही हूँ। मुझे ना मुझे मेरा मानकोर से राशन कार्ड है, तो मुझे यहाँ पर ट्रांसफर करवाना है।",saarika:v2.5,,,pending_review,,2026-02-05T21:40:05.109722
Helpdesk,Hd_Q_30.ogg,मी संध्या पवार बोलते माझं आधार कार्ड पॅन कार्ड लिंक झालं आहे आर डी खोलण्यासाठी कोणते कोणते डॉक्युमेंट्स लागतील ते सांगा,saarika:v2.5,,,pending_review,,2026-02-05T21:40:08.231079
Helpdesk,Hd_Q_31.ogg,मी संगीता नडगे माझ्या मुलाचं आधार कार्ड अपडेट केलेलं आहे पण अजून आलेलं नाही,saarika:v2.5,,,pending_review,,2026-02-05T21:40:11.335076
Helpdesk,Hd_Q_32.ogg,गुडमेश कुमार मुझे आई स्मेल कार्ड निकालना है,saarika:v2.5,,,pending_review,,2026-02-05T21:40:14.026147
Helpdesk,Hd_Q_33.ogg,"मी नीलम मिरके, माझ्या मुलांचं राशन कार्डावरती नाव चढवायचं आहे आणि माझं पण नाव चढवायचं आहे.",saarika:v2.5,,,pending_review,,2026-02-05T21:40:17.477335
Helpdesk,Hd_Q_34.ogg,"मी निकिता महाले, मला मॅरेज सर्टिफिकेट काढायचं आहे, काय काय डॉक्युमेंट लागतील?",saarika:v2.5,,,pending_review,,2026-02-05T21:40:20.389436
Helpdesk,Hd_Q_35.ogg,"मॅडम मी कल्पना लोतडे, मला मॅरेज सर्टिफिकेट बनवायचं आहे. त्याच्यासाठी काय काय डॉक्युमेंट्स लागणार आहेत?",saarika:v2.5,,,pending_review,,2026-02-05T21:40:23.912632
Helpdesk,Hd_Q_36.ogg,"हाय प्रीती मॅडम, मी अपर्णा पवार बोलते. 
म्हणजे दोन महिन्यांचे पेंडिंग होते सात ही ॲपचे बॅलन्स जे मी आता भरले आहेत आणि फेब्रुवारीचे सुद्धा भरलेले आहेत. 
तर तुम्ही एकदा चेक करा ओके. 
सरांनी सांगितलेलं की पे केल्यानंतर तुम्हाला सांगायला. 
त्यामुळे तुम्हाला मेसेज करते. 
तर डिसेंबर, जानेवारी आणि फेब्रुवारीचे असे तीन महिन्याचे मी भरलेले आहेत. 
ठीक आहे तुम्ही एकदा चेक करा मॅडम.",saarika:v2.5,,,pending_review,,2026-02-05T21:40:27.793220
Helpdesk,Hd_Q_37.ogg,प्रीती मॅडम मी तन्वी राणे बोलते मला स्कॉलरशिपसाठी ईमेल आला आहे,saarika:v2.5,,,pending_review,,2026-02-05T21:40:30.562379
Helpdesk,Hd_Q_38.ogg,मैं दिव्या पाली बोल रही हूँ ये पूछना था कि लोन कभी पूरा होगा और दूसरा लोन ले सकते हैं क्या ज़रूरत है इसलिए,saarika:v2.5,,,pending_review,,2026-02-05T21:40:34.007400
Helpdesk,Hd_Q_39.ogg,"मी राजेश गावडे, मला गव्हर्मेंटची ₹20 ची पॉलिसी पाहिजे.",saarika:v2.5,,,pending_review,,2026-02-05T21:40:36.400770
Helpdesk,Hd_Q_40.ogg,हेलो सर मैं दर्शना बोल रही हूँ मुंबई सेंटर टेलीवेजंस से मेरा आसमान कार्ड बनाने का है क्या डॉक्यूमेंट्स लाने का है,saarika:v2.5,,,pending_review,,2026-02-05T21:40:39.568213
Helpdesk,Hd_Q_41.ogg,"मी आरती शिराळ, माझं आणि माझ्या मुलाचं आधार कार्ड अपडेट केलं ते आलं नाही, मला पाहिजे आहे.",saarika:v2.5,,,pending_review,,2026-02-05T21:40:42.508593
Helpdesk,Hd_Q_42.ogg,"मी पुष्पा, माझं आयुष्मान कार्ड हरवलं आहे, मला परत काढायचं आहे.",saarika:v2.5,,,pending_review,,2026-02-05T21:40:44.917582
Helpdesk,Hd_Q_43.ogg,"मी माझं नाव भारती पागे आहे, मला आयुष्मान कार्ड काढायचा आहे, काय काय डॉक्युमेंट लागतील?",saarika:v2.5,,,pending_review,,2026-02-05T21:40:47.327784
Helpdesk,Hd_Q_44.ogg,हाय दीदी मैं कल्पना सनी बोल रही हूँ बी सी ए ऑफिस से मुझे आधार कार्ड और पैन कार्ड लिंक कराना है,saarika:v2.5,,,pending_review,,2026-02-05T21:40:50.854778
Helpdesk,Hd_Q_45.ogg,मी सरिता पागे माझ्या राशन कार्डवरती ऑनलाईन नावं दिसत नाही,saarika:v2.5,,,pending_review,,2026-02-05T21:40:53.545043
Helpdesk,Hd_Q_46.ogg,मैं कलैरसी मेरा बेटी के नेम रेसन कार्ड में लगाने का उसको आधार कार्ड नहीं है बेड सर्टिफिकेट है,saarika:v2.5,,,pending_review,,2026-02-05T21:40:56.812168
Helpdesk,Hd_Q_47.ogg,"स्मिता, मी स्मिता होसाळकर. माझ्या पॅन कार्डवर आज स्पेलिंग चेंज करायची आहे. त्यासाठी काय काय डॉक्युमेंट लागतील?",saarika:v2.5,,,pending_review,,2026-02-05T21:41:00.261856
Helpdesk,Hd_Q_48.ogg,"मी जयंती सावंत, माझ्या आईकडचा आधार प्रेशर कार्ड नाव कट केले पण ते दिसत नाहीये.",saarika:v2.5,,,pending_review,,2026-02-05T21:41:02.711718
Helpdesk,Hd_Q_49.ogg,"मी जयंती सावंत, मला माझ्या हसबंडचं आणि मुलांचं आयुष्यमान कार्ड बनवायचं आहे.",saarika:v2.5,,,pending_review,,2026-02-05T21:41:05.238439
Helpdesk,Hd_Q_50.ogg,"मेरा नाम लक्ष्मी है, मेरा राशन कार्ड का है, और राशन मेरा नाम पे मिलते है, तीनों बच्चों को नहीं मिलते है।",saarika:v2.5,,,pending_review,,2026-02-05T21:41:08.313188
Helpdesk,Hd_Q_51.ogg,मैं उमा रानी बोल रही हूँ एम ए डी सी से मुझे आयुष्मान कार्ड मेरे हसबैंड के लिए और मेरे बच्चे के लिए बनाना है क्या क्या डॉक्यूमेंट चाहिए,saarika:v2.5,,,pending_review,,2026-02-05T21:41:11.621347
Helpdesk,Hd_Q_52.ogg,मैं बबीता विलास परदेसी मुंबई सेंट्रल आई जी पी से मुझे लोन चाहिए,saarika:v2.5,,,pending_review,,2026-02-05T21:41:14.394576
Helpdesk,Hd_Q_53.ogg,हॅलो प्रीती मी सारिका बोलते मला रेशन कार्डमध्ये ना गॅजेट तयार झाले ना तर आता तिथे काय करायला जाऊ काय काय डॉक्युमेंट्स घेऊन जायला लागेल,saarika:v2.5,,,pending_review,,2026-02-05T21:41:17.705753
Helpdesk,Hd_Q_54.1.ogg,मॉर्निंग हनु मैडम मेरा ये महीने में लास्ट रहेगा वो देने का लोन का फिर अगले महीने में मैं फ्री हो जाती हूँ तो मुझे मिल जाएगा तो इस महीने में मिल जाता तो अगले महीने से फिर मेरा पैसा कटिंग करना चालू कर देती मैंने गए महीने में चेक करवाया था मेरा ये मंथ है ना लास्ट था इसीलिए मैंने मैसेज डाला है,saarika:v2.5,,,pending_review,,2026-02-05T21:41:22.030746
Helpdesk,Hd_Q_54.ogg,हेलो गुड आफ्टरनून निशा जहाँ बोल रही हूँ मेरा लोन ये ये मंथ में एंड फिनिश हो जाएगा नेक्स्ट मंथ में मुझे लोन वापस मिल सकता है क्या,saarika:v2.5,,,pending_review,,2026-02-05T21:41:25.511660
Helpdesk,Hd_Q_55.ogg,सॉरी गुड आफ्टरनून मैं बी सी ऑफिस से वत्सला बामने मुझे आयुष्मान कार्ड बनवाना है,saarika:v2.5,,,pending_review,,2026-02-05T21:41:28.532247
Helpdesk,Hd_Q_56.ogg,मैं जीसी ऑफिस से अदिता बोल रही हूँ मेरा आधार कार्ड अपडेट करना है दो तीन महीने पहले मैं यहाँ पर कराई थी आई टी सी में अभी तक आया नहीं है अपडेट ओके वो सब तक आएगा,saarika:v2.5,,,pending_review,,2026-02-05T21:41:32.178449
Helpdesk,Hd_Q_57.1.ogg,मेरा है ना आधार कार्ड पैन कार्ड वोटर आई डी ये तीनों पे एड्रेस चेंज करना है,saarika:v2.5,,,pending_review,,2026-02-05T21:41:35.246370
Helpdesk,Hd_Q_57.ogg,"मैं अंजू, मैं बीसी ऑफिस से बोल रही हूँ, मुझे है ना डॉक्यूमेंट्स पे एड्रेस चेंज कराना है, तो क्या-क्या अप्रूफ लाना है, तो आप मुझे बता दीजिए।",saarika:v2.5,,,pending_review,,2026-02-05T21:41:38.318189
Helpdesk,Hd_Q_58.ogg,"दिनेश सर, पहले मेरी बेटी का लड़की बहना का पैसा मिल रहा था। अभी ये दो महीने से नहीं मिल रहा है, जरा चेक करो ना क्या प्रॉब्लम है।",saarika:v2.5,,,pending_review,,2026-02-05T21:41:41.152985
Helpdesk,Hd_Q_59.ogg,"येणारच लोन आज येणार होतं, आलं नाहीये हे.",saarika:v2.5,,,pending_review,,2026-02-05T21:41:44.256654
Helpdesk,Hd_Q_60.ogg,हेलो प्रीति एम आई डी सी से साहिस्ता बोल रही हूँ आयुष्मान कार्ड बनवाने के लिए फैमिली कब बोला था,saarika:v2.5,,,pending_review,,2026-02-05T21:41:47.818644
Helpdesk,Hd_Q_9.ogg,प्रीती मला पण आय डी चं ॲड्रेस बदली करायचं आहे मी येऊ का,saarika:v2.5,,,pending_review,,2026-02-05T21:41:50.626185
HR/Admin,HR_Ad_Q_1.ogg,ਛੱਬੀ ਜਨਵਰੀ ਤੋਂ ਛੁੱਟੀ ਹੈ ਕਿ ਚਾਲੂ ਹੈ,saarika:v2.5,,,pending_review,,2026-02-05T21:41:53.574705
HR/Admin,HR_Ad_Q_10.ogg,"मैं सरजू बात कर रहा हूँ बीसी ऑफिस से, मेरे पीएफ की जानकारी चाहिए।",saarika:v2.5,,,pending_review,,2026-02-05T21:41:56.281456
HR/Admin,HR_Ad_Q_11.ogg,"उनके बारे में। अरे सर, मैं अलोन की तो बाकी ये भाई जी बोल रही है इससे बात कर।",saarika:v2.5,,,pending_review,,2026-02-05T21:41:58.463501
HR/Admin,HR_Ad_Q_12.1.ogg,तो दीदी मेरा ये जो लोन का जो खत्म करना है ये कितने महीने में खत्म हो जाएगा और है ना मुझे है ना प्रीति दीदी से बात करना है प्रीति दीदी शायद आ नहीं रही है तो जरा उनको भेजिए तो मैं उनसे पूछूँ,saarika:v2.5,,,pending_review,,2026-02-05T21:42:02.283260
HR/Admin,HR_Ad_Q_12.ogg,हाय टाइनी टीम मैं भारती विक्रम परदेसी बोल रही हूँ बीसी ऑफिस से मुझे यह जानना है कि जो मैंने कंपनी से लोन लिया था पचास हजार तो वो अभी तक मतलब कितना और बाकी है भरना और मैं फिर दोबारा कब लोन के लिए अप्लाई कर सकती हूँ और किसको बोलना है मुझे लोन के लिए प्लीज मुझे यह बताइए,saarika:v2.5,,,pending_review,,2026-02-05T21:42:06.988489
HR/Admin,HR_Ad_Q_13.ogg,,saarika:v2.5,,,error,,2026-02-05T21:42:10.445271
HR/Admin,HR_Ad_Q_14.ogg,"आईजीपी में ना मैं रेखा बोल रही हूँ, आईजीपी में कितना दिन से मच्छर काट रहे हैं, लेकिन उसका कोई सलूशन नहीं निकल रहा है, क्यों ऐसा?",saarika:v2.5,,,pending_review,,2026-02-05T21:42:13.694149
HR/Admin,HR_Ad_Q_2.ogg,"मैं टेनी मेडिकल से बोल रहा हूं।
बॉम्बे सेंटर से।
सर मेडिसिन मेरे को चाहिए था सर्दी और बदन दर्द के लिए।
तो ये लोग स्टाफ लोग बोल रहे हैं कि नहीं है करके।
और रखना बंद कर दिया है, पहले रखते थे सर।
ठीक है।",saarika:v2.5,,,pending_review,,2026-02-05T21:42:16.991634
HR/Admin,HR_Ad_Q_3.ogg,"मेरा नाम ज्योति है, मैं बी सी से बोल रही हूँ, मुझे मेरा पी एफ का अमाउंट जानना है।",saarika:v2.5,,,pending_review,,2026-02-05T21:42:19.790601
HR/Admin,HR_Ad_Q_4.ogg,मैं हदीका बोल रही हूँ मुझे ना पीएफ के बारे में बोलना है पीएफ का पैसा मुझे ना निकाल के ट्राई करना है कि मेरा आ पा रहा है कि नहीं ठीक है,saarika:v2.5,,,pending_review,,2026-02-05T21:42:22.996434
HR/Admin,HR_Ad_Q_5.ogg,मैं हेमलता परदेसी बी सी ऑफिस से मुझे मेरा पी एफ का पैसा जानना है,saarika:v2.5,,,pending_review,,2026-02-05T21:42:26.367712
HR/Admin,HR_Ad_Q_6.ogg,मैं बबीता विलास बोल रही हूँ मेरा पूरे साल का पी एफ कितना जमा हुआ है वो भी मुझे पता करना है,saarika:v2.5,,,pending_review,,2026-02-05T21:42:29.210363
HR/Admin,HR_Ad_Q_7.ogg,मुझे पीएफ निकालना है,saarika:v2.5,,,pending_review,,2026-02-05T21:42:30.996102
HR/Admin,HR_Ad_Q_8.ogg,मैं डायनिंग कंपनी से बोल रही हूँ अप्सरा ग्रांड डोर बिल्डिंग से मेरा पीएफ का पैसा कितना जमा हुआ है आप बता दो,saarika:v2.5,,,pending_review,,2026-02-05T21:42:34.844567
