Department,File Name,STT Transcription,STT Model,Human Reviewed,Final,Status,Reviewer,Timestamp
HR/Admin,HR_Ad_Q_9.ogg,"सर, मैं अजीब खान बोल रहा हूं। अजीब खान बोल रहा हूं। रिजी सर से काम है, मेरा पीएफ का पैसा है और लोन कितना कट है आप बताइए प्लीज।",saarika:v2.5,,,pending_review,,2026-02-05T21:42:37.915283
Production,P_Q_1.ogg,पच्चीस दिसंबर को हमारा ऑप्शनल छुट्टी था तो हमने फिर भी इधर भरा था तो हमको डबल मिलेगा या सिंगल पेमेंट मिलेगा मैं बबीता विलास बोल रही हूँ,saarika:v2.5,,,pending_review,,2026-02-05T21:42:41.705159
Production,P_Q_2.ogg,हाय मैं भारती बोल रही हूँ बी सी ऑफिस से मुझे ये जानना है कि मुझे मेरा समर हुडी बैग कितना हुआ है और उसका कितना पैसा हुआ है और जी डब्ल्यू पी जो अभी चालू हुआ है वो कितना पीस हुआ है उसका कितना पेमेंट हुआ है ये महीने में मेरा टोटल कितना पेमेंट हुआ है मुझे वो जानना है,saarika:v2.5,,,pending_review,,2026-02-05T21:42:45.236550
Production,P_Q_3.ogg,हेलो सर गुड इवनिंग इधर एक्स्ट्रा काम रहेगा ना अपना सब लेडीज लोग बोल रहे इवनिंग में एक घंटा और टाइम चाहिए शायद पेपरवरी में से उन लोग को चाहिए करके बोल रहे,saarika:v2.5,,,pending_review,,2026-02-05T21:42:48.556953
Production,P_Q_4.ogg,हमें ओटी के टाइम में शाम को ही नाश्ता चाहिए। चार बजे नाश्ता करेंगे तो सात बजे भूख लगती है और चाय भी नहीं मिलती है।,saarika:v2.5,,,pending_review,,2026-02-05T21:42:51.763641
Production,P_Q_5.ogg,हमें चार बजे नाश्ता नहीं चाहिए साढ़े छः बजे चाय और नाश्ता दोनों चाहिए,saarika:v2.5,,,pending_review,,2026-02-05T21:42:54.914780
Production,P_Q_6.ogg,हमें चार बजे नाश्ता नहीं चाहिए हमें साढ़े छः बजे नाश्ता और चाय चाहिए,saarika:v2.5,,,pending_review,,2026-02-05T21:42:57.677797
Production,P_Q_7.ogg,हेलो मैं संचिता आई के बोल रही हूँ मेरे मशीन पे जो भी कारीगर बैठता है सब कुछ चीज़ कोई भी जगह पे नहीं रखता स्क्रू ड्राइवर नहीं है पट्टी नहीं है मशीन का सिलाई बड़ा टाका करके ऐसे ही छोड़ के जाता है,saarika:v2.5,,,pending_review,,2026-02-05T21:43:01.589982
Production,P_Q_8.ogg,हलो सर मैं धनराज बोल रहा हूँ राकेश सर मैं अभी इधर पर हूँ अभी ऑफिस में मैं लेबल मांग रहा हूँ तो लेबल मेरे को नहीं दे रहे सर और मैं अभी वो लेबल की वजह से मेरा काम रुका है अभी,saarika:v2.5,,,pending_review,,2026-02-05T21:43:05.461219
Production,P_Q_9.ogg,,saarika:v2.5,,,error,,2026-02-05T21:43:09.329710
